uuid,name,class,shortname,description,reference-term-code,reference-term-relationship,reference-term-source,child.1,child.2,child.3,child.4,child.5,child.6,child.7,child.8,child.9,child.10,child.11,child.12,
,"Coronary Heart Disease, Followup, Diagnosis",Misc,Diagnosis details,,,,,"Coronary Heart Disease, Followup, Symptoms of Angina today","Coronary Heart Disease, Followup, Measuring Severity of illness","Coronary Heart Disease, Followup, Chief complaint","Coronary Heart Disease, Followup, New symptom / History of present illness","Coronary Heart Disease, Followup, Current Medicines","Coronary Heart Disease, Followup, Non compliance","Coronary Heart Disease, Followup, Reason",,,,,,
,"Coronary Heart Disease, Followup, New Diagnostics",Misc,New Diagnostics,,,,,"Coronary Heart Disease, Followup, EKG","Coronary Heart Disease, Followup, Lipids/A1C if due","Coronary Heart Disease, Followup, A1c result",,,,,,,,,,
,"Coronary Heart Disease, Followup, Physical Examination",Misc,Physical Examination,,,,,"Coronary Heart Disease, Followup, BP Systolic Data, Systolic","Coronary Heart Disease, Followup, BP Systolic Data, Systolic Abnormal","Coronary Heart Disease, Followup, BP Diastolic Data, Diastolic","Coronary Heart Disease, Followup, BP Diastolic Data, Diastolic Abnormal","Coronary Heart Disease, Followup, Heart rate data, Pulse","Coronary Heart Disease, Followup, Heart rate data, Pulse Abnormal","Coronary Heart Disease, Followup, RR data, RR","Coronary Heart Disease, Followup, RR data, RR Abnormal","Coronary Heart Disease, Followup, SAT data, SAT","Coronary Heart Disease, Followup, SAT data, SAT Abnormal","Coronary Heart Disease, Followup, Temperature data, Temperature","Coronary Heart Disease, Followup, Temperature data, Temperature Abnormal","Coronary Heart Disease, Followup, Physical Examination Details"
,"Coronary Heart Disease, Followup, ER and likely IPD",Misc,,,,,,"Coronary Heart Disease, Followup, ER and likely IPD admission","Coronary Heart Disease, Followup, Refer to outside hospital",,,,,,,,,,,
,"Coronary Heart Disease, Followup, Assessment / Follow up",Misc,Assessment / Follow up,,,,,"Coronary Heart Disease, Followup, Assessment","Coronary Heart Disease, Followup, Management","Coronary Heart Disease, Followup, Checklist","Coronary Heart Disease, Followup, Preventive therapies",,,,,,,,,
,Coronary heart disease - Examination / Follow up,Misc,,,,,,"Coronary Heart Disease, Followup, Diagnosis","Coronary Heart Disease, Followup, Physical Examination","Coronary Heart Disease, Followup, New Diagnostics","Coronary Heart Disease, Followup, ER and likely IPD","Coronary Heart Disease, Followup, Assessment / Follow up",,,,,,,,
