Uuid,Void/Retire,Same as mappings,Fully specified name:en,Fully specified name:fr,Short name:en,Short name:fr,Description:en,Description:fr,Data class,Data type,Answers,Members,_version:1,_order:1000,
127197AAAAAAAAAAAAAAAAAAAAAAAAAAAAAA,,ICD-10:N70.9,Salpingitis and Oophoritis (N70.9),Salpingite et ovarite (N70.9),Salpingitis and Oophoritis,Salpingite et ovarite,,,Diagnosis,N/A,,,,,
127214AAAAAAAAAAAAAAAAAAAAAAAAAAAAAA,,ICD-10:S33.6,Sacrum Sprain (S33.6),Entorse de sacrum (S33.6),Sacrum Sprain,Entorse de sacrum,,,Diagnosis,N/A,,,,,
127331AAAAAAAAAAAAAAAAAAAAAAAAAAAAAA,,ICD-10:L71.9,Rosacea (L71.9),Acne rosacee (L71.9),Rosacea,Acne rosacee,,,Diagnosis,N/A,,,,,
127437AAAAAAAAAAAAAAAAAAAAAAAAAAAAAA,,ICD-10:I05.0,Rheumatic mitral stenosis (I05.0),"Cardiopathie rhumatismale, stenose mitrale (I05.0)",Rheumatic mitral stenosis,"Cardiopathie rhumatismale, stenose mitrale",,,Diagnosis,N/A,,,,,
127484AAAAAAAAAAAAAAAAAAAAAAAAAAAAAA,,ICD-10:J39.0,Retropharyngeal and parapharyngeal abscess (J39.0),Abces parapharynge et retropharynge (J39.0),Retropharyngeal and parapharyngeal abscess,Abces parapharynge et retropharynge,,,Diagnosis,N/A,,,,,
127527AAAAAAAAAAAAAAAAAAAAAAAAAAAAAA,,ICD-10:C69.2,Retinoblastoma (C69.2),Retinoblastome (C69.2),Retinoblastoma,Retinoblastome,,,Diagnosis,N/A,,,,,
127601AAAAAAAAAAAAAAAAAAAAAAAAAAAAAA,,ICD-10:N89.7,Hematocolpos (N89.7),Hematocolpos (N89.7),Hematocolpos,Hematocolpos,,,Diagnosis,N/A,,,,,
127608AAAAAAAAAAAAAAAAAAAAAAAAAAAAAA,,ICD-10:K08.3,Retained Dental Root (K08.3),Racine dentaire laissee en place (K08.3),Retained Dental Root,Racine dentaire laissee en place,,,Diagnosis,N/A,,,,,
127638AAAAAAAAAAAAAAAAAAAAAAAAAAAAAA,,ICD-10:P22.0,Respiratory distress syndrome in the newborn (P22.0),Syndrome de detresse respiratoire du nouveau-ne (P22.0),Respiratory distress syndrome in the newborn,Syndrome de detresse respiratoire du nouveau-ne,,,Diagnosis,N/A,,,,,
127639AAAAAAAAAAAAAAAAAAAAAAAAAAAAAA,,ICD-10:R06.8,Respiratory Distress (R06.8),Detresse respiratoire (R06.8),Respiratory Distress,Detresse respiratoire,,,Diagnosis,N/A,,,,,
127655AAAAAAAAAAAAAAAAAAAAAAAAAAAAAA,,ICD-10:M79.5,Residual Foreign Body in Soft Tissue (M79.5),Corps etranger residuel dans un tissu mou (M79.5),Residual Foreign Body in Soft Tissue,Corps etranger residuel dans un tissu mou,,,Diagnosis,N/A,,,,,
127707AAAAAAAAAAAAAAAAAAAAAAAAAAAAAA,,ICD-10:N23,Renal Colic (N23),Colique nephretique (N23),Renal Colic,Colique nephretique,,,Diagnosis,N/A,,,,,
127741AAAAAAAAAAAAAAAAAAAAAAAAAAAAAA,,ICD-10:M35.6,Relapsing Febrile Nodular Nonsuppurative Panniculitis (M35.6),Panniculite recidivante (M35.6),Relapsing Febrile Nodular Nonsuppurative Panniculitis,Panniculite recidivante,,,Diagnosis,N/A,,,,,
127744AAAAAAAAAAAAAAAAAAAAAAAAAAAAAA,,ICD-10:R11,Regurgitation (R11),Regurgitations (R11),Regurgitation,Regurgitations,,,Diagnosis,N/A,,,,,
127784AAAAAAAAAAAAAAAAAAAAAAAAAAAAAA,,ICD-10:J06.9,Recurrent Upper Respiratory Tract Infection (J06.9),Infections recurrentes des voies respiratoires superieures (J06.9),Recurrent Upper Respiratory Tract Infection,Infections recurrentes des voies respiratoires superieures,,,Diagnosis,N/A,,,,,
127794AAAAAAAAAAAAAAAAAAAAAAAAAAAAAA,,ICD-10:F30.8,"Recurrent Manic Episodes, Mild (F30.8)",Autres episodes maniaques (F30.8),"Recurrent Manic Episodes, Mild",Autres episodes maniaques,,,Diagnosis,N/A,,,,,
127841AAAAAAAAAAAAAAAAAAAAAAAAAAAAAA,,ICD-10:K12.0,Recurrent aphthous ulcer (K12.0),Aphtes buccaux recidivants (K12.0),Recurrent aphthous ulcer,Aphtes buccaux recidivants,,,Diagnosis,N/A,,,,,
127850AAAAAAAAAAAAAAAAAAAAAAAAAAAAAA,,ICD-10:K62.3,Rectal Prolapse (K62.3),Prolapsus rectal (K62.3),Rectal Prolapse,Prolapsus rectal,,,Diagnosis,N/A,,,,,
127851AAAAAAAAAAAAAAAAAAAAAAAAAAAAAA,,ICD-10:K62.1,Rectal Polyp (K62.1),Polype rectal (K62.1),Rectal Polyp,Polype rectal,,,Diagnosis,N/A,,,,,
127857AAAAAAAAAAAAAAAAAAAAAAAAAAAAAA,,ICD-10:K61.1,Rectal Abscess (K61.1),Abces rectal (perirectal) (K61.1),Rectal Abscess,Abces rectal (perirectal),,,Diagnosis,N/A,,,,,
128006AAAAAAAAAAAAAAAAAAAAAAAAAAAAAA,,ICD-10:L98.0,Pyogenic Granuloma (L98.0),Granulome pyogenique (L98.0),Pyogenic Granuloma,Granulome pyogenique,,,Diagnosis,N/A,,,,,
128007AAAAAAAAAAAAAAAAAAAAAAAAAAAAAA,,ICD-10:M00.9,"Pyogenic Arthritis, Site Unspecified (M00.9)",Arthrite a bacteries pyogenes (M00.9),"Pyogenic Arthritis, Site Unspecified",Arthrite a bacteries pyogenes,,,Diagnosis,N/A,,,,,
128019AAAAAAAAAAAAAAAAAAAAAAAAAAAAAA,,ICD-10:L88,Pyoderma Gangrenosum (L88),Pyodermite gangreneuse (L88),Pyoderma Gangrenosum,Pyodermite gangreneuse,,,Diagnosis,N/A,,,,,
128101AAAAAAAAAAAAAAAAAAAAAAAAAAAAAA,,ICD-10:I37.0,Pulmonic Valve Stenosis (I37.0),Stenose de la valvule pulmonaire (I37.0),Pulmonic Valve Stenosis,Stenose de la valvule pulmonaire,,,Diagnosis,N/A,,,,,
128148AAAAAAAAAAAAAAAAAAAAAAAAAAAAAA,,ICD-10:Q25.6,Pulmonary Artery Stenosis (Q25.6),Stenose de l'artere pulmonaire (Q25.6),Pulmonary Artery Stenosis,Stenose de l'artere pulmonaire,,,Diagnosis,N/A,,,,,
128267AAAAAAAAAAAAAAAAAAAAAAAAAAAAAA,,ICD-10:L66.0,Pseudopelade (L66.0),Pseudopelade (L66.0),Pseudopelade,Pseudopelade,,,Diagnosis,N/A,,,,,
128294AAAAAAAAAAAAAAAAAAAAAAAAAAAAAA,,ICD-10:L73.1,Pseudofolliculitis Barbae (L73.1),Pseudofolliculite de la barbe (L73.1),Pseudofolliculitis Barbae,Pseudofolliculite de la barbe,,,Diagnosis,N/A,,,,,
128298AAAAAAAAAAAAAAAAAAAAAAAAAAAAAA,,ICD-10:K86.3,Pseudocyst of Pancreas (K86.3),Pseudokyste du pancreas (K86.3),Pseudocyst of Pancreas,Pseudokyste du pancreas,,,Diagnosis,N/A,,,,,
128319AAAAAAAAAAAAAAAAAAAAAAAAAAAAAA,,ICD-10:L28.2,Prurigo Simplex (L28.2),Autres formes de prurigo (L28.2),Prurigo Simplex,Autres formes de prurigo,,,Diagnosis,N/A,,,,,
128324AAAAAAAAAAAAAAAAAAAAAAAAAAAAAA,,ICD-10:Q79.4,Prune Belly Syndrome (Q79.4),Aplasie congenitale de la musculature abdominale (Syndrome d'Obrinsky) (Q79.4),Prune Belly Syndrome,Aplasie congenitale de la musculature abdominale (Syndrome d'Obrinsky),,,Diagnosis,N/A,,,,,
128494AAAAAAAAAAAAAAAAAAAAAAAAAAAAAA,,ICD-10:N91.0,Primary amenorrhea (N91.0),Amenorrhee primaire (N91.0),Primary amenorrhea,Amenorrhee primaire,,,Diagnosis,N/A,,,,,
128644AAAAAAAAAAAAAAAAAAAAAAAAAAAAAA,,ICD-10:C66,Malignant Neoplasm of Ureter (C66),Tumeur maligne de l'uretere (C66),Malignant Neoplasm of Ureter,Tumeur maligne de l'uretere,,,Diagnosis,N/A,,,,,
128700AAAAAAAAAAAAAAAAAAAAAAAAAAAAAA,,ICD-10:C08.0,Primary Malignant Neoplasm of Submaxillary Gland (C08.0),Tumeur maligne de la glande sous-maxillaire (C08.0),Primary Malignant Neoplasm of Submaxillary Gland,Tumeur maligne de la glande sous-maxillaire,,,Diagnosis,N/A,,,,,
128701AAAAAAAAAAAAAAAAAAAAAAAAAAAAAA,,ICD-10:C08.1,Primary Malignant Neoplasm of Sublingual Gland (C08.1),Tumeur maligne de la glande sublinguale (C08.1),Primary Malignant Neoplasm of Sublingual Gland,Tumeur maligne de la glande sublinguale,,,Diagnosis,N/A,,,,,
128728AAAAAAAAAAAAAAAAAAAAAAAAAAAAAA,,ICD-10:C44.9,Dermatofibrosarcoma protuberans (C44.9),Dermatofibrosarcome protuberant (C44.9),Dermatofibrosarcoma protuberans,Dermatofibrosarcome protuberant,,,Diagnosis,N/A,,,,,
128779AAAAAAAAAAAAAAAAAAAAAAAAAAAAAA,,ICD-10:C65,Malignant Neoplasm of Renal Pelvis (C65),Tumeur maligne du bassinet (C65),Malignant Neoplasm of Renal Pelvis,Tumeur maligne du bassinet,,,Diagnosis,N/A,,,,,
128803AAAAAAAAAAAAAAAAAAAAAAAAAAAAAA,,ICD-10:C58,Malignant neoplasm of placenta (C58),Tumeur maligne du placenta (C58),Malignant neoplasm of placenta,Tumeur maligne du placenta,,,Diagnosis,N/A,,,,,
128884AAAAAAAAAAAAAAAAAAAAAAAAAAAAAA,,ICD-10:C41.1,Primary Malignant Neoplasm of Mandible (C41.1),Tumeur maligne de la mandibule (C41.1),Primary Malignant Neoplasm of Mandible,Tumeur maligne de la mandibule,,,Diagnosis,N/A,,,,,
129079AAAAAAAAAAAAAAAAAAAAAAAAAAAAAA,,ICD-10:C21.1,Malignant Neoplasm of Anal Canal (C21.1),Tumeur maligne du canal anal (C21.1),Malignant Neoplasm of Anal Canal,Tumeur maligne du canal anal,,,Diagnosis,N/A,,,,,
129103AAAAAAAAAAAAAAAAAAAAAAAAAAAAAA,,ICD-10:K63.9,Primary Intestinal Lymphangiectasia (K63.9),Lymphangiectasie intestinal primaire (K63.9),Primary Intestinal Lymphangiectasia,Lymphangiectasie intestinal primaire,,,Diagnosis,N/A,,,,,
129207AAAAAAAAAAAAAAAAAAAAAAAAAAAAAA,,ICD-10:K00.6,Premature tooth eruption (K00.6),Eruption prematuree des dents (K00.6),Premature tooth eruption,Eruption prematuree des dents,,,Diagnosis,N/A,,,,,
129208AAAAAAAAAAAAAAAAAAAAAAAAAAAAAA,,ICD-10:K00.6,Premature shedding of primary tooth (K00.6),Chute prematuree des dents temporaires (K00.6),Premature shedding of primary tooth,Chute prematuree des dents temporaires,,,Diagnosis,N/A,,,,,
129211AAAAAAAAAAAAAAAAAAAAAAAAAAAAAA,,ICD-10:O42.9,Premature rupture of membranes (O42.9),Rupture prematuree des membranes (O42.9),Premature rupture of membranes,Rupture prematuree des membranes,,,Diagnosis,N/A,,,,,
129240AAAAAAAAAAAAAAAAAAAAAAAAAAAAAA,,ICD-10:O10.9,Pre-existing hypertension complicating pregnancy and childbirth (O10.9),"Hypertension preexistante compliquant la grossesse, l'accouchement et la puerperalite (O10.9)",Pre-existing hypertension complicating pregnancy and childbirth,"Hypertension preexistante compliquant la grossesse, l'accouchement et la puerperalite",,,Diagnosis,N/A,,,,,
129264AAAAAAAAAAAAAAAAAAAAAAAAAAAAAA,,ICD-10:O62.3,Precipitate labor (O62.3),Travail trop rapide (O62.3),Precipitate labor,Travail trop rapide,,,Diagnosis,N/A,,,,,
129285AAAAAAAAAAAAAAAAAAAAAAAAAAAAAA,,ICD-10:T79.3,Posttraumatic wound infection (T79.3),Infection post-traumatique d'une plaie (T79.3),Posttraumatic wound infection,Infection post-traumatique d'une plaie,,,Diagnosis,N/A,,,,,
129317AAAAAAAAAAAAAAAAAAAAAAAAAAAAAA,,ICD-10:Z39.2,Postpartum state (Z39.2),Consultation postnatale de routine (Z39.2),Postpartum state,Consultation postnatale de routine,,,Diagnosis,N/A,,,,,
129484AAAAAAAAAAAAAAAAAAAAAAAAAAAAAA,,ICD-10:K76.6,Portal Hypertension (K76.6),Hypertension portale (K76.6),Portal Hypertension,Hypertension portale,,,Diagnosis,N/A,,,,,
1294AAAAAAAAAAAAAAAAAAAAAAAAAAAAAAAA,,ICD-10:B45.1,Cryptococcal meningitis (B45.1),Meningite a cryptocoques (B45.1),Cryptococcal meningitis,Meningite a cryptocoques,,,Diagnosis,N/A,,,,,
129537AAAAAAAAAAAAAAAAAAAAAAAAAAAAAA,,ICD-10:N84.0,Endometrial polyp (N84.0),Polype d'endometrial (N84.0),Endometrial polyp,Polype d'endometrial,,,Diagnosis,N/A,,,,,
129540AAAAAAAAAAAAAAAAAAAAAAAAAAAAAA,,ICD-10:N84.1,Polyp of cervix (N84.1),Polype du col de l'uterus (N84.1),Polyp of cervix,Polype du col de l'uterus,,,Diagnosis,N/A,,,,,
129559AAAAAAAAAAAAAAAAAAAAAAAAAAAAAA,,ICD-10:O40,Polyhydramnios (O40),Hydramnios (O40),Polyhydramnios,Hydramnios,,,Diagnosis,N/A,,,,,
129566AAAAAAAAAAAAAAAAAAAAAAAAAAAAAA,,ICD-10:Q69.9,Polydactyly (Q69.9),Polydactylie (Q69.9),Polydactyly,Polydactylie,,,Diagnosis,N/A,,,,,
129569AAAAAAAAAAAAAAAAAAAAAAAAAAAAAA,,ICD-10:E28.2,Polycystic Ovaries (E28.2),Syndrome des ovaires polykystiques (E28.2),Polycystic Ovaries,Syndrome des ovaires polykystiques,,,Diagnosis,N/A,,,,,
129574AAAAAAAAAAAAAAAAAAAAAAAAAAAAAA,,ICD-10:M30.0,Polyarteritis Nodosa (M30.0),Polyarterite noueux (M30.0),Polyarteritis Nodosa,Polyarterite noueux,,,Diagnosis,N/A,,,,,
130022AAAAAAAAAAAAAAAAAAAAAAAAAAAAAA,,ICD-10:B59,Pneumocystosis (B59),Pneumocystose (B59),Pneumocystosis,Pneumocystose,,,Diagnosis,N/A,,,,,
130088AAAAAAAAAAAAAAAAAAAAAAAAAAAAAA,,ICD-10:L40.8,Plaque Psoriasis (L40.8),Psoriasis en plaques (L40.8),Plaque Psoriasis,Psoriasis en plaques,,,Diagnosis,N/A,,,,,
130108AAAAAAAAAAAAAAAAAAAAAAAAAAAAAA,,ICD-10:O45.9,Abruptio placentae (O45.9),Decollement premature du placenta (O45.9),Abruptio placentae,Decollement premature du placenta,,,Diagnosis,N/A,,,,,
130109AAAAAAAAAAAAAAAAAAAAAAAAAAAAAA,,ICD-10:O43.8,Placental abnormality (O43.8),Anomalies du placenta (O43.8),Placental abnormality,Anomalies du placenta,,,Diagnosis,N/A,,,,,
130149AAAAAAAAAAAAAAAAAAAAAAAAAAAAAA,,ICD-10:B36.0,Pityriasis versicolor (B36.0),Pityriasis versicolor (B36.0),Pityriasis versicolor,Pityriasis versicolor,,,Diagnosis,N/A,,,,,
130151AAAAAAAAAAAAAAAAAAAAAAAAAAAAAA,,ICD-10:L44.0,Pityriasis rubra pilaire (L44.0),Pityriasis rubra pilaris (L44.0),Pityriasis rubra pilaire,Pityriasis rubra pilaris,,,Diagnosis,N/A,,,,,
130155AAAAAAAAAAAAAAAAAAAAAAAAAAAAAA,,ICD-10:L30.5,Pityriasis Alba (L30.5),Pityriasis alba (L30.5),Pityriasis Alba,Pityriasis alba,,,Diagnosis,N/A,,,,,
130225AAAAAAAAAAAAAAAAAAAAAAAAAAAAAA,,ICD-10:R62.9,Physiologically Young for Age (R62.9),Retard psychomoteur (R62.9),Physiologically Young for Age,Retard psychomoteur,,,Diagnosis,N/A,,,,,
130304AAAAAAAAAAAAAAAAAAAAAAAAAAAAAA,,ICD-10:J06.0,Pharyngolaryngitis (J06.0),Laryngo-pharyngite aigue (J06.0),Pharyngolaryngitis,Laryngo-pharyngite aigue,,,Diagnosis,N/A,,,,,
130314AAAAAAAAAAAAAAAAAAAAAAAAAAAAAA,,ICD-10:G54.6,Phantom Limb Syndrome (G54.6),Syndrome douloureux du membre fantome (G54.6),Phantom Limb Syndrome,Syndrome douloureux du membre fantome,,,Diagnosis,N/A,,,,,
130368AAAAAAAAAAAAAAAAAAAAAAAAAAAAAA,,ICD-10:P29.3,Persistent fetal circulation (P29.3),Persistance de la circulation foetale (P29.3),Persistent fetal circulation,Persistance de la circulation foetale,,,Diagnosis,N/A,,,,,
130376AAAAAAAAAAAAAAAAAAAAAAAAAAAAAA,,ICD-10:S84.1,Peroneal nerve injury (S84.1),Lesion du nerf sciatique poplite externe (S84.1),Peroneal nerve injury,Lesion du nerf sciatique poplite externe,,,Diagnosis,N/A,,,,,
130392AAAAAAAAAAAAAAAAAAAAAAAAAAAAAA,,ICD-10:K66.0,Peritoneal Adhesion (K66.0),Adherences peritoneales (K66.0),Peritoneal Adhesion,Adherences peritoneales,,,Diagnosis,N/A,,,,,
130461AAAAAAAAAAAAAAAAAAAAAAAAAAAAAA,,ICD-10:L71.0,Perioral Dermatitis (L71.0),Dermatite periorale (L71.0),Perioral Dermatitis,Dermatite periorale,,,Diagnosis,N/A,,,,,
130517AAAAAAAAAAAAAAAAAAAAAAAAAAAAAA,,ICD-10:P54.3,Perinatal gastrointestinal haemorrhage (P54.3),Hemorragies gastro-intestinales neonatales (P54.3),Perinatal gastrointestinal haemorrhage,Hemorragies gastro-intestinales neonatales,,,Diagnosis,N/A,,,,,
130520AAAAAAAAAAAAAAAAAAAAAAAAAAAAAA,,ICD-10:P54.5,Perinatal cutaneous haemorrhage (P54.5),Hemorragie cutanee neonatale (P54.5),Perinatal cutaneous haemorrhage,Hemorragie cutanee neonatale,,,Diagnosis,N/A,,,,,
130578AAAAAAAAAAAAAAAAAAAAAAAAAAAAAA,,ICD-10:H72.9,Perforation Of Tympanic Membrane (H72.9),Perforation du tympan (H72.9),Perforation Of Tympanic Membrane,Perforation du tympan,,,Diagnosis,N/A,,,,,
130580AAAAAAAAAAAAAAAAAAAAAAAAAAAAAA,,ICD-10:K63.1,Perforation of Intestine (K63.1),Perforation de l'intestin (non traumatique) (K63.1),Perforation of Intestine,Perforation de l'intestin (non traumatique),,,Diagnosis,N/A,,,,,
130623AAAAAAAAAAAAAAAAAAAAAAAAAAAAAA,,ICD-10:L10.0,Pemphigus Vulgaris (L10.0),Pemphigus vulgaire (L10.0),Pemphigus Vulgaris,Pemphigus vulgaire,,,Diagnosis,N/A,,,,,
130625AAAAAAAAAAAAAAAAAAAAAAAAAAAAAA,,ICD-10:L10.2,Pemphigus Foliaceus (L10.2),Pemphigus foliace (L10.2),Pemphigus Foliaceus,Pemphigus foliace,,,Diagnosis,N/A,,,,,
130651AAAAAAAAAAAAAAAAAAAAAAAAAAAAAA,,ICD-10:K65.8,Pelvic Abscess (K65.8),Abces pelvien (K65.8),Pelvic Abscess,Abces pelvien,,,Diagnosis,N/A,,,,,
130714AAAAAAAAAAAAAAAAAAAAAAAAAAAAAA,,ICD-10:Q21.1,Patent Foramen Ovale (Q21.1),Permeabilite du foramen ovale (Q21.1),Patent Foramen Ovale,Permeabilite du foramen ovale,,,Diagnosis,N/A,,,,,
130715AAAAAAAAAAAAAAAAAAAAAAAAAAAAAA,,ICD-10:Q25.0,Patent ductus arteriosus (Q25.0),Permeabilite du canal arteriel (Q25.0),Patent ductus arteriosus,Permeabilite du canal arteriel,,,Diagnosis,N/A,,,,,
130765AAAAAAAAAAAAAAAAAAAAAAAAAAAAAA,,ICD-10:K00.0,Hypodontia (K00.0),Hypodontie (K00.0),Hypodontia,Hypodontie,,,Diagnosis,N/A,,,,,
130792AAAAAAAAAAAAAAAAAAAAAAAAAAAAAA,,ICD-10:R22.0,Parotid Swelling (R22.0),Tumefaction de la parotide (R22.0),Parotid Swelling,Tumefaction de la parotide,,,Diagnosis,N/A,,,,,
130864AAAAAAAAAAAAAAAAAAAAAAAAAAAAAA,,ICD-10:I63.9,Paralytic Stroke (I63.9),"Infarctus cerebral, sans precision (I63.9)",Paralytic Stroke,"Infarctus cerebral, sans precision",,,Diagnosis,N/A,,,,,
130867AAAAAAAAAAAAAAAAAAAAAAAAAAAAAA,,ICD-10:K56.0,Paralytic Ileus (K56.0),Ileus paralytique (K56.0),Paralytic Ileus,Ileus paralytique,,,Diagnosis,N/A,,,,,
130966AAAAAAAAAAAAAAAAAAAAAAAAAAAAAA,,ICD-10:F41.0,Panic disorder (F41.0),Trouble panique [anxiete episodique paroxystique] (F41.0),Panic disorder,Trouble panique [anxiete episodique paroxystique],,,Diagnosis,N/A,,,,,
130967AAAAAAAAAAAAAAAAAAAAAAAAAAAAAA,,ICD-10:F41.0,Panic Attack (F41.0),Attaque de panique (F41.0),Panic Attack,Attaque de panique,,,Diagnosis,N/A,,,,,
131021AAAAAAAAAAAAAAAAAAAAAAAAAAAAAA,,ICD-10:N64.4,Mastodynia (N64.4),Mastodynia (N64.4),Mastodynia,Mastodynia,,,Diagnosis,N/A,,,,,
131036AAAAAAAAAAAAAAAAAAAAAAAAAAAAAA,,ICD-10:M79.6,Pain in Limb (M79.6),Douleurs dans les membres (M79.6),Pain in Limb,Douleurs dans les membres,,,Diagnosis,N/A,,,,,
131518AAAAAAAAAAAAAAAAAAAAAAAAAAAAAA,,ICD-10:O66.8,Obstructed Labor (O66.8),Travail dystocique (O66.8),Obstructed Labor,Travail dystocique,,,Diagnosis,N/A,,,,,
131602AAAAAAAAAAAAAAAAAAAAAAAAAAAAAA,,ICD-10:H92.0,Otalgia (H92.0),Otalgie (H92.0),Otalgia,Otalgie,,,Diagnosis,N/A,,,,,
131651AAAAAAAAAAAAAAAAAAAAAAAAAAAAAA,,ICD-10:M17.9,Osteoarthritis of Knee (M17.9),Osteo-arthrite du genou (M17.9),Osteoarthritis of Knee,Osteo-arthrite du genou,,,Diagnosis,N/A,,,,,
131694AAAAAAAAAAAAAAAAAAAAAAAAAAAAAA,,ICD-10:R13,Oropharyngeal Dysphagia (R13),Dysphagie oropharyngee (R13),Oropharyngeal Dysphagia,Dysphagie oropharyngee,,,Diagnosis,N/A,,,,,
131791AAAAAAAAAAAAAAAAAAAAAAAAAAAAAA,,ICD-10:L63.2,Ophiasis (L63.2),Ophiasis (L63.2),Ophiasis,Ophiasis,,,Diagnosis,N/A,,,,,
131804AAAAAAAAAAAAAAAAAAAAAAAAAAAAAA,,ICD-10:S61.9,Open Wound of Wrist (S61.9),Plaie ouverte du poignet et de la main (S61.9),Open Wound of Wrist,Plaie ouverte du poignet et de la main,,,Diagnosis,N/A,,,,,
131818AAAAAAAAAAAAAAAAAAAAAAAAAAAAAA,,ICD-10:S41.1,Open Wound of Upper Arm (S41.1),Plaie ouverte du bras (S41.1),Open Wound of Upper Arm,Plaie ouverte du bras,,,Diagnosis,N/A,,,,,
131856AAAAAAAAAAAAAAAAAAAAAAAAAAAAAA,,ICD-10:S41.0,Open Wound of Shoulder Region (S41.0),Plaie ouverte de l'epaule et du bras (S41.0),Open Wound of Shoulder Region,Plaie ouverte de l'epaule et du bras,,,Diagnosis,N/A,,,,,
131865AAAAAAAAAAAAAAAAAAAAAAAAAAAAAA,,ICD-10:S41.8,Open wound of scapular region (S41.8),Plaie ouverte de parties de la ceinture scapulaire (S41.8),Open wound of scapular region,Plaie ouverte de parties de la ceinture scapulaire,,,Diagnosis,N/A,,,,,
131868AAAAAAAAAAAAAAAAAAAAAAAAAAAAAA,,ICD-10:S01.0,Open Wound of Scalp (S01.0),Plaie ouverte du cuir chevelu (S01.0),Open Wound of Scalp,Plaie ouverte du cuir chevelu,,,Diagnosis,N/A,,,,,
131890AAAAAAAAAAAAAAAAAAAAAAAAAAAAAA,,ICD-10:S11.9,Open Wound of Neck (S11.9),Plaie ouverte du cou (S11.9),Open Wound of Neck,Plaie ouverte du cou,,,Diagnosis,N/A,,,,,
131925AAAAAAAAAAAAAAAAAAAAAAAAAAAAAA,,ICD-10:S81.9,Open Wound of Lower Leg (S81.9),Plaie ouverte de la jambe (S81.9),Open Wound of Lower Leg,Plaie ouverte de la jambe,,,Diagnosis,N/A,,,,,
131958AAAAAAAAAAAAAAAAAAAAAAAAAAAAAA,,ICD-10:S01.9,Open Wound of Head (S01.9),Plaie ouverte de la tete (S01.9),Open Wound of Head,Plaie ouverte de la tete,,,Diagnosis,N/A,,,,,
131977AAAAAAAAAAAAAAAAAAAAAAAAAAAAAA,,ICD-10:S51.9,Open Wound of Forearm (S51.9),Plaie ouverte de l'avant-bras (S51.9),Open Wound of Forearm,Plaie ouverte de l'avant-bras,,,Diagnosis,N/A,,,,,
131984AAAAAAAAAAAAAAAAAAAAAAAAAAAAAA,,ICD-10:S91.3,Open Wound of Foot (S91.3),Plaie ouverte du pied (S91.3),Open Wound of Foot,Plaie ouverte du pied,,,Diagnosis,N/A,,,,,
132338AAAAAAAAAAAAAAAAAAAAAAAAAAAAAA,,ICD-10:T14.2,Open fracture (T14.2),Fracture ouverte (T14.2),Open fracture,Fracture ouverte,,,Diagnosis,N/A,,,,,
132387AAAAAAAAAAAAAAAAAAAAAAAAAAAAAA,,ICD-10:B35.1,Fungal nail infection (B35.1),Infection fongique de l’ongle (B35.1),Fungal nail infection,Infection fongique de l’ongle,,,Diagnosis,N/A,,,,,
132390AAAAAAAAAAAAAAAAAAAAAAAAAAAAAA,,ICD-10:L60.1,Onycholysis (L60.1),Onycholyse (L60.1),Onycholysis,Onycholyse,,,Diagnosis,N/A,,,,,
132391AAAAAAAAAAAAAAAAAAAAAAAAAAAAAA,,ICD-10:L60.2,Onychogryposis (L60.2),Onychogryphose (L60.2),Onychogryposis,Onychogryphose,,,Diagnosis,N/A,,,,,
132407AAAAAAAAAAAAAAAAAAAAAAAAAAAAAA,,ICD-10:P38,Omphalitis of the newborn (P38),Omphalite du nouveau-ne (P38),Omphalitis of the newborn,Omphalite du nouveau-ne,,,Diagnosis,N/A,,,,,
132425AAAAAAAAAAAAAAAAAAAAAAAAAAAAAA,,ICD-10:O41.0,Oligohydramnios (O41.0),Oligoamnios (O41.0),Oligohydramnios,Oligoamnios,,,Diagnosis,N/A,,,,,
132611AAAAAAAAAAAAAAAAAAAAAAAAAAAAAA,,ICD-10:F42.9,Obsessive-Compulsive Disorder (F42.9),Trouble obsessionnel-compulsif (F42.9),Obsessive-Compulsive Disorder,Trouble obsessionnel-compulsif,,,Diagnosis,N/A,,,,,
132766AAAAAAAAAAAAAAAAAAAAAAAAAAAAAA,,ICD-10:I62.0,Non-traumatic subdural hemorrhage (I62.0),Hemorragie sous-durale non traumatique (I62.0),Non-traumatic subdural hemorrhage,Hemorragie sous-durale non traumatique,,,Diagnosis,N/A,,,,,
132805AAAAAAAAAAAAAAAAAAAAAAAAAAAAAA,,ICD-10:E04.2,Non-Toxic Multinodular Goiter (E04.2),"Goitre non toxique, multinodulaire (E04.2)",Non-Toxic Multinodular Goiter,"Goitre non toxique, multinodulaire",,,Diagnosis,N/A,,,,,
132827AAAAAAAAAAAAAAAAAAAAAAAAAAAAAA,,ICD-10:I63.9,Nonparalytic stroke (I63.9),"Infarctus cerebral, non paralysant (I63.9)",Nonparalytic stroke,"Infarctus cerebral, non paralysant",,,Diagnosis,N/A,,,,,
133010AAAAAAAAAAAAAAAAAAAAAAAAAAAAAA,,ICD-10:Z03.9,No Pathologic Diagnosis (Z03.9),Aucun diagnostic pathologique (Z03.9),No Pathologic Diagnosis,Aucun diagnostic pathologique,,,Diagnosis,N/A,,,,,
133126AAAAAAAAAAAAAAAAAAAAAAAAAAAAAA,,ICD-10:M79.2,Neuralgia (M79.2),Nevralgie (M79.2),Neuralgia,Nevralgie,,,Diagnosis,N/A,,,,,
133206AAAAAAAAAAAAAAAAAAAAAAAAAAAAAA,,ICD-10:D39.0,Neoplasm of Uterus (D39.0),Cancer de l'endometre (D39.0),Neoplasm of Uterus,Cancer de l'endometre,,,Diagnosis,N/A,,,,,
133391AAAAAAAAAAAAAAAAAAAAAAAAAAAAAA,,ICD-10:P59.0,Neonatal Jaundice Associated with Preterm Delivery (P59.0),Ictere du premature (P59.0),Neonatal Jaundice Associated with Preterm Delivery,Ictere du premature,,,Diagnosis,N/A,,,,,
133393AAAAAAAAAAAAAAAAAAAAAAAAAAAAAA,,ICD-10:P39.9,Infection of Newborn (P39.9),Infection du nouveau-ne (P39.9),Infection of Newborn,Infection du nouveau-ne,,,Diagnosis,N/A,,,,,
133418AAAAAAAAAAAAAAAAAAAAAAAAAAAAAA,,ICD-10:P37.5,Neonatal candidiasis (P37.5),Candidose neonatale (P37.5),Neonatal candidiasis,Candidose neonatale,,,Diagnosis,N/A,,,,,
133443AAAAAAAAAAAAAAAAAAAAAAAAAAAAAA,,ICD-10:M72.6,Necrotizing Fasciitis (M72.6),Fasciite necrosante (M72.6),Necrotizing Fasciitis,Fasciite necrosante,,,Diagnosis,N/A,,,,,
133461AAAAAAAAAAAAAAAAAAAAAAAAAAAAAA,,ICD-10:L92.1,Necrobiosis Lipoidica (L92.1),Necrobiose lipoïdique (L92.1),Necrobiosis Lipoidica,Necrobiose lipoïdique,,,Diagnosis,N/A,,,,,
133468AAAAAAAAAAAAAAAAAAAAAAAAAAAAAA,,ICD-10:S13.6,Neck Sprain (S13.6),Entorse du cou (S13.6),Neck Sprain,Entorse du cou,,,Diagnosis,N/A,,,,,
133469AAAAAAAAAAAAAAAAAAAAAAAAAAAAAA,,ICD-10:M54.2,Neck pain (M54.2),Douleur au cou (M54.2),Neck pain,Douleur au cou,,,Diagnosis,N/A,,,,,
133473AAAAAAAAAAAAAAAAAAAAAAAAAAAAAA,,ICD-10:R11,Nausea and Vomiting (R11),Nausee et vomissements (R11),Nausea and Vomiting,Nausee et vomissements,,,Diagnosis,N/A,,,,,
133709AAAAAAAAAAAAAAAAAAAAAAAAAAAAAA,,ICD-10:C90.0,Multiple Myeloma (C90.0),Myelome multiple (C90.0),Multiple Myeloma,Myelome multiple,,,Diagnosis,N/A,,,,,
133947AAAAAAAAAAAAAAAAAAAAAAAAAAAAAA,,ICD-10:L94.0,Morphea (L94.0),Morphee (L94.0),Morphea,Morphee,,,Diagnosis,N/A,,,,,
133972AAAAAAAAAAAAAAAAAAAAAAAAAAAAAA,,ICD-10:G58.9,Mononeuropathy (G58.9),Mononevrite (G58.9),Mononeuropathy,Mononevrite,,,Diagnosis,N/A,,,,,
134026AAAAAAAAAAAAAAAAAAAAAAAAAAAAAA,,ICD-10:J45.9,Moderate persistent asthma (J45.9),Asthme persistant modere (J45.9),Moderate persistent asthma,Asthme persistant modere,,,Diagnosis,N/A,,,,,
134034AAAAAAAAAAAAAAAAAAAAAAAAAAAAAA,,ICD-10:F80.2,Mixed Receptive-Expressive Language Disorder (F80.2),"Trouble de l'acquisition du langage, de type receptif (F80.2)",Mixed Receptive-Expressive Language Disorder,"Trouble de l'acquisition du langage, de type receptif",,,Diagnosis,N/A,,,,,
134082AAAAAAAAAAAAAAAAAAAAAAAAAAAAAA,,ICD-10:I05.0,Mitral Valve Stenosis (I05.0),Stenose mitrale (I05.0),Mitral Valve Stenosis,Stenose mitrale,,,Diagnosis,N/A,,,,,
134132AAAAAAAAAAAAAAAAAAAAAAAAAAAAAA,,ICD-10:L74.1,Miliaria Crystallina (L74.1),Miliaire cristalline (L74.1),Miliaria Crystallina,Miliaire cristalline,,,Diagnosis,N/A,,,,,
134161AAAAAAAAAAAAAAAAAAAAAAAAAAAAAA,,ICD-10:J45.9,Mild intermittent asthma (J45.9),Asthme intermittent leger (J45.9),Mild intermittent asthma,Asthme intermittent leger,,,Diagnosis,N/A,,,,,
134213AAAAAAAAAAAAAAAAAAAAAAAAAAAAAA,,ICD-10:Q02,Microcephalus (Q02),Microcephalie (Q02),Microcephalus,Microcephalie,,,Diagnosis,N/A,,,,,
134292AAAAAAAAAAAAAAAAAAAAAAAAAAAAAA,,ICD-10:K00.1,Mesiodens (K00.1),Mesiodens (K00.1),Mesiodens,Mesiodens,,,Diagnosis,N/A,,,,,
134394AAAAAAAAAAAAAAAAAAAAAAAAAAAAAA,,ICD-10:K92.1,Melaena (K92.1),Melaena (K92.1),Melaena,Melaena,,,Diagnosis,N/A,,,,,
134495AAAAAAAAAAAAAAAAAAAAAAAAAAAAAA,,ICD-10:Q43.0,Meckel's Diverticulum (Q43.0),Diverticule de Meckel (Q43.0),Meckel's Diverticulum,Diverticule de Meckel,,,Diagnosis,N/A,,,,,
134567AAAAAAAAAAAAAAAAAAAAAAAAAAAAAA,,ICD-10:A92.8,Mayaro Fever (A92.8),Fievre de Mayaro (A92.8),Mayaro Fever,Fievre de Mayaro,,,Diagnosis,N/A,,,,,
134696AAAAAAAAAAAAAAAAAAAAAAAAAAAAAA,,ICD-10:F30.9,Manic episode (F30.9),Episode maniaque (F30.9),Manic episode,Episode maniaque,,,Diagnosis,N/A,,,,,
134734AAAAAAAAAAAAAAAAAAAAAAAAAAAAAA,,ICD-10:C51.9,Malignant Tumor of Vulva (C51.9),Tumeur maligne de la vulve (C51.9),Malignant Tumor of Vulva,Tumeur maligne de la vulve,,,Diagnosis,N/A,,,,,
134736AAAAAAAAAAAAAAAAAAAAAAAAAAAAAA,,ICD-10:C41.2,Malignant Tumor of Vertebral Column (C41.2),Tumeur maligne des rachis (C41.2),Malignant Tumor of Vertebral Column,Tumeur maligne des rachis,,,Diagnosis,N/A,,,,,
