Uuid,Void/Retire,Same as mappings,Fully specified name:en,Fully specified name:fr,Short name:en,Short name:fr,Description:en,Description:fr,Data class,Data type,Answers,Members,_version:1,_order:1000,
147230AAAAAAAAAAAAAAAAAAAAAAAAAAAAAA,,ICD-10:K05.5,Bleeding Gums (K05.5),Saignement gingival (K05.5),Bleeding Gums,Saignement gingival,,,Diagnosis,N/A,,,,,
147243AAAAAAAAAAAAAAAAAAAAAAAAAAAAAA,,ICD-10:B40.9,Blastomycosis (B40.9),Blastomycose (B40.9),Blastomycosis,Blastomycose,,,Diagnosis,N/A,,,,,
147363AAAAAAAAAAAAAAAAAAAAAAAAAAAAAA,,ICD-10:K40.0,Bilateral Inguinal Hernia with Obstruction but no Gangrene (K40.0),"Hernie inguinale bilaterale, avec occlusion, sans gangrene (K40.0)",Bilateral Inguinal Hernia with Obstruction but no Gangrene,"Hernie inguinale bilaterale, avec occlusion, sans gangrene",,,Diagnosis,N/A,,,,,
147364AAAAAAAAAAAAAAAAAAAAAAAAAAAAAA,,ICD-10:K40.1,Bilateral Inguinal Hernia with Gangrene (K40.1),"Hernie inguinale bilaterale, avec gangrene (K40.1)",Bilateral Inguinal Hernia with Gangrene,"Hernie inguinale bilaterale, avec gangrene",,,Diagnosis,N/A,,,,,
147365AAAAAAAAAAAAAAAAAAAAAAAAAAAAAA,,ICD-10:K40.2,Bilateral Inguinal Hernia (K40.2),"Hernie inguinale bilaterale,sans occlusion ni gangrene (K40.2)",Bilateral Inguinal Hernia,"Hernie inguinale bilaterale,sans occlusion ni gangrene",,,Diagnosis,N/A,,,,,
147375AAAAAAAAAAAAAAAAAAAAAAAAAAAAAA,,ICD-10:Q65.1,Bilateral congenital dislocation of hip (Q65.1),"Luxation congenitale de la hanche, bilaterale (Q65.1)",Bilateral congenital dislocation of hip,"Luxation congenitale de la hanche, bilaterale",,,Diagnosis,N/A,,,,,
147593AAAAAAAAAAAAAAAAAAAAAAAAAAAAAA,,ICD-10:D26.0,Benign Neoplasm of Uterine Cervix (D26.0),Tumeur benigne du col de l'uterus (D26.0),Benign Neoplasm of Uterine Cervix,Tumeur benigne du col de l'uterus,,,Diagnosis,N/A,,,,,
147603AAAAAAAAAAAAAAAAAAAAAAAAAAAAAA,,ICD-10:D34,Benign Neoplasm of Thyroid Gland (D34),Tumeur benigne de la thyroïde (D34),Benign Neoplasm of Thyroid Gland,Tumeur benigne de la thyroïde,,,Diagnosis,N/A,,,,,
147619AAAAAAAAAAAAAAAAAAAAAAAAAAAAAA,,ICD-10:D13.1,Benign Neoplasm of Stomach (D13.1),Tumeur benigne de l'estomac (D13.1),Benign Neoplasm of Stomach,Tumeur benigne de l'estomac,,,Diagnosis,N/A,,,,,
147669AAAAAAAAAAAAAAAAAAAAAAAAAAAAAA,,ICD-10:D29.4,Benign neoplasm of scrotum (D29.4),Tumeur benigne du scrotum (D29.4),Benign neoplasm of scrotum,Tumeur benigne du scrotum,,,Diagnosis,N/A,,,,,
147692AAAAAAAAAAAAAAAAAAAAAAAAAAAAAA,,ICD-10:D11.0,Benign Neoplasm of Parotid Gland (D11.0),Tumeur benigne de glande parotide (D11.0),Benign Neoplasm of Parotid Gland,Tumeur benigne de glande parotide,,,Diagnosis,N/A,,,,,
147699AAAAAAAAAAAAAAAAAAAAAAAAAAAAAA,,ICD-10:D13.6,Benign Neoplasm of Pancreas (D13.6),Tumeur benigne du pancreas (D13.6),Benign Neoplasm of Pancreas,Tumeur benigne du pancreas,,,Diagnosis,N/A,,,,,
147708AAAAAAAAAAAAAAAAAAAAAAAAAAAAAA,,ICD-10:D27,Benign neoplasm of ovary (D27),Tumeur benigne de l'ovaire (D27),Benign neoplasm of ovary,Tumeur benigne de l'ovaire,,,Diagnosis,N/A,,,,,
147758AAAAAAAAAAAAAAAAAAAAAAAAAAAAAA,,ICD-10:D13.4,Benign Neoplasm of Liver (D13.4),Tumeur benigne du foie (D13.4),Benign Neoplasm of Liver,Tumeur benigne du foie,,,Diagnosis,N/A,,,,,
147801AAAAAAAAAAAAAAAAAAAAAAAAAAAAAA,,ICD-10:D28.2,Benign Neoplasm of Fallopian Tube (D28.2),Tumeur benigne des trompes de fallope (D28.2),Benign Neoplasm of Fallopian Tube,Tumeur benigne des trompes de fallope,,,Diagnosis,N/A,,,,,
147805AAAAAAAAAAAAAAAAAAAAAAAAAAAAAA,,ICD-10:D13.0,Benign Neoplasm of Esophagus (D13.0),Tumeur benigne de l'oesophage (D13.0),Benign Neoplasm of Esophagus,Tumeur benigne de l'oesophage,,,Diagnosis,N/A,,,,,
147825AAAAAAAAAAAAAAAAAAAAAAAAAAAAAA,,ICD-10:D12.6,Benign Neoplasm of Colon (D12.6),Tumeur benigne du colon (D12.6),Benign Neoplasm of Colon,Tumeur benigne du colon,,,Diagnosis,N/A,,,,,
147845AAAAAAAAAAAAAAAAAAAAAAAAAAAAAA,,ICD-10:D16.9,Benign Neoplasm of Bone (D16.9),Tumeur benigne des os (D16.9),Benign Neoplasm of Bone,Tumeur benigne des os,,,Diagnosis,N/A,,,,,
147860AAAAAAAAAAAAAAAAAAAAAAAAAAAAAA,,ICD-10:D12.9,Benign Neoplasm of Anus (D12.9),Tumeur benigne de l'anus et du canal anal (D12.9),Benign Neoplasm of Anus,Tumeur benigne de l'anus et du canal anal,,,Diagnosis,N/A,,,,,
147920AAAAAAAAAAAAAAAAAAAAAAAAAAAAAA,,ICD-10:M35.2,Behcet's Syndrome (M35.2),Syndrome de Behcet (M35.2),Behcet's Syndrome,Syndrome de Behcet,,,Diagnosis,N/A,,,,,
147967AAAAAAAAAAAAAAAAAAAAAAAAAAAAAA,,ICD-10:N75.8,Bartholinitis (N75.8),Bartholinite (N75.8),Bartholinitis,Bartholinite,,,Diagnosis,N/A,,,,,
148069AAAAAAAAAAAAAAAAAAAAAAAAAAAAAA,,ICD-10:J09,Avian influenza (J09),"Grippe, a virus de grippe aviaire identifie (J09)",Avian influenza,"Grippe, a virus de grippe aviaire identifie",,,Diagnosis,N/A,,,,,
148143AAAAAAAAAAAAAAAAAAAAAAAAAAAAAA,,ICD-10:X84,Attempted Suicide (X84),Tentative de suicide (X84),Attempted Suicide,Tentative de suicide,,,Diagnosis,N/A,,,,,
148278AAAAAAAAAAAAAAAAAAAAAAAAAAAAAA,,ICD-10:L85.3,Asteatosis Cutis (L85.3),Xerose cutanee (L85.3),Asteatosis Cutis,Xerose cutanee,,,Diagnosis,N/A,,,,,
148298AAAAAAAAAAAAAAAAAAAAAAAAAAAAAA,,ICD-10:X93,Assault by Handgun (X93),Agression par arme de poing (X93),Assault by Handgun,Agression par arme de poing,,,Diagnosis,N/A,,,,,
148303AAAAAAAAAAAAAAAAAAAAAAAAAAAAAA,,ICD-10:X99,Assault by Cutting and Piercing Instrument (X99),Agression par objet tranchant (X99),Assault by Cutting and Piercing Instrument,Agression par objet tranchant,,,Diagnosis,N/A,,,,,
148546AAAAAAAAAAAAAAAAAAAAAAAAAAAAAA,,ICD-10:I35.1,Aortic Valve Regurgitation (I35.1),Insuffisance de la valvule aortique (I35.1),Aortic Valve Regurgitation,Insuffisance de la valvule aortique,,,Diagnosis,N/A,,,,,
148654AAAAAAAAAAAAAAAAAAAAAAAAAAAAAA,,ICD-10:K61.2,Anorectal Abscess (K61.2),Abces ano-rectal (K61.2),Anorectal Abscess,Abces ano-rectal,,,Diagnosis,N/A,,,,,
148833AAAAAAAAAAAAAAAAAAAAAAAAAAAAAA,,ICD-10:P61.2,Anaemia of prematurity (P61.2),Anemie de la prematurite (P61.2),Anaemia of prematurity,Anemie de la prematurite,,,Diagnosis,N/A,,,,,
148900AAAAAAAAAAAAAAAAAAAAAAAAAAAAAA,,ICD-10:K62.0,Anal Polyp (K62.0),Polype anal (K62.0),Anal Polyp,Polype anal,,,Diagnosis,N/A,,,,,
148904AAAAAAAAAAAAAAAAAAAAAAAAAAAAAA,,ICD-10:K60.2,Anal Fissure (K60.2),Fissure anale (K60.2),Anal Fissure,Fissure anale,,,Diagnosis,N/A,,,,,
148968AAAAAAAAAAAAAAAAAAAAAAAAAAAAAA,,ICD-10:O42.9,Amniotic Fluid Leaking (O42.9),Passage de liquide amniotique (O42.9),Amniotic Fluid Leaking,Passage de liquide amniotique,,,Diagnosis,N/A,,,,,
148989AAAAAAAAAAAAAAAAAAAAAAAAAAAAAA,,ICD-10:N91.2,Amenorrhea (N91.2),Amenorrhee (N91.2),Amenorrhea,Amenorrhee,,,Diagnosis,N/A,,,,,
8b24f981-9078-47dc-bcf6-c24358f706c7,,ICD-10:N92.0,Menorrhagia (N92.0),Menorragie (N92.0),Menorrhagia,Menorragie,,,Diagnosis,N/A,,,,,
6d9c595d-215b-4895-83d5-dadcbb2e164b,,ICD-10:N94.1,Dyspareunia (N94.1),Dyspareunie (N94.1),Dyspareunia,Dyspareunie,,,Diagnosis,N/A,,,,,
148990AAAAAAAAAAAAAAAAAAAAAAAAAAAAAA,,ICD-10:K00.5,Amelogenesis imperfecta (K00.5),Amelogenesis imperfecta (K00.5),Amelogenesis imperfecta,Amelogenesis imperfecta,,,Diagnosis,N/A,,,,,
149001AAAAAAAAAAAAAAAAAAAAAAAAAAAAAA,,ICD-10:A06.4,Amebic Liver Abscess (A06.4),Abces amibien du foie (A06.4),Amebic Liver Abscess,Abces amibien du foie,,,Diagnosis,N/A,,,,,
149057AAAAAAAAAAAAAAAAAAAAAAAAAAAAAA,,ICD-10:L63.1,Alopecia Universalis (L63.1),Alopecie universalis (L63.1),Alopecia Universalis,Alopecie universalis,,,Diagnosis,N/A,,,,,
149058AAAAAAAAAAAAAAAAAAAAAAAAAAAAAA,,ICD-10:L63.0,Alopecia Totalis (L63.0),Alopecie totale (L63.0),Alopecia Totalis,Alopecie totale,,,Diagnosis,N/A,,,,,
149062AAAAAAAAAAAAAAAAAAAAAAAAAAAAAA,,ICD-10:L63.9,Alopecia Areata (L63.9),Alopecie areata (L63.9),Alopecia Areata,Alopecie areata,,,Diagnosis,N/A,,,,,
149151AAAAAAAAAAAAAAAAAAAAAAAAAAAAAA,,ICD-10:K70.9,Alcoholic Liver Damage (K70.9),Maladie alcoolique du foie (K70.9),Alcoholic Liver Damage,Maladie alcoolique du foie,,,Diagnosis,N/A,,,,,
149195AAAAAAAAAAAAAAAAAAAAAAAAAAAAAA,,ICD-10:L94.6,Ainhum (L94.6),Ainhum (L94.6),Ainhum,Ainhum,,,Diagnosis,N/A,,,,,
149482AAAAAAAAAAAAAAAAAAAAAAAAAAAAAA,,ICD-10:K05.0,Acute Ulcerative Gingivitis (K05.0),Gingivite ulcereuse aigue (K05.0),Acute Ulcerative Gingivitis,Gingivite ulcereuse aigue,,,Diagnosis,N/A,,,,,
149496AAAAAAAAAAAAAAAAAAAAAAAAAAAAAA,,ICD-10:J03.9,Acute Tonsillitis (J03.9),Amygdalite aigue (J03.9),Acute Tonsillitis,Amygdalite aigue,,,Diagnosis,N/A,,,,,
149514AAAAAAAAAAAAAAAAAAAAAAAAAAAAAA,,ICD-10:F43.0,Acute Stress Reaction (F43.0),Reaction aigue a un facteur de stress (F43.0),Acute Stress Reaction,Reaction aigue a un facteur de stress,,,Diagnosis,N/A,,,,,
149554AAAAAAAAAAAAAAAAAAAAAAAAAAAAAA,,ICD-10:N10,Acute pyelonephritis (N10),Pyelonephrite aigue (N10),Acute pyelonephritis,Pyelonephrite aigue,,,Diagnosis,N/A,,,,,
149566AAAAAAAAAAAAAAAAAAAAAAAAAAAAAA,,ICD-10:D62,Acute posthemorrhagic anemia (D62),Anemie posthemorragique aigue (D62),Acute posthemorrhagic anemia,Anemie posthemorragique aigue,,,Diagnosis,N/A,,,,,
149707AAAAAAAAAAAAAAAAAAAAAAAAAAAAAA,,ICD-10:L41.0,Acute lichenoid pityriasis (L41.0),Pityriasis lichenoïde et varioliforme aigu (L41.0),Acute lichenoid pityriasis,Pityriasis lichenoïde et varioliforme aigu,,,Diagnosis,N/A,,,,,
149743AAAAAAAAAAAAAAAAAAAAAAAAAAAAAA,,ICD-10:B17.1,Acute Hepatitis C (B17.1),Hepatite C aigue (B17.1),Acute Hepatitis C,Hepatite C aigue,,,Diagnosis,N/A,,,,,
149871AAAAAAAAAAAAAAAAAAAAAAAAAAAAAA,,ICD-10:D57.0,Acute chest syndrome (D57.0),Syndrome thoracique aigu (D57.0),Acute chest syndrome,Syndrome thoracique aigu,,,Diagnosis,N/A,,,,,
149938AAAAAAAAAAAAAAAAAAAAAAAAAAAAAA,,ICD-10:R10.0,Acute Abdomen (R10.0),Syndrome abdominal aigu (R10.0),Acute Abdomen,Syndrome abdominal aigu,,,Diagnosis,N/A,,,,,
149946AAAAAAAAAAAAAAAAAAAAAAAAAAAAAA,,ICD-10:A42.9,Actinomycotic Infection (A42.9),Actinomycose (A42.9),Actinomycotic Infection,Actinomycose,,,Diagnosis,N/A,,,,,
149949AAAAAAAAAAAAAAAAAAAAAAAAAAAAAA,,ICD-10:L57.0,Actinic Keratosis (L57.0),Keratose actinique (L57.0),Actinic Keratosis,Keratose actinique,,,Diagnosis,N/A,,,,,
149964AAAAAAAAAAAAAAAAAAAAAAAAAAAAAA,,ICD-10:L90.4,Acrodermatitis Atrophicans Chronica (L90.4),Acrodermatite chronique atrophiante (L90.4),Acrodermatitis Atrophicans Chronica,Acrodermatite chronique atrophiante,,,Diagnosis,N/A,,,,,
14d11d8a-e179-4590-a35d-2eeef0eca5aa,,ICD-10:A82.9,Rabies (A82.9),Rage (A82.9),Rabies,Rage,,,Diagnosis,N/A,,,,,
150042AAAAAAAAAAAAAAAAAAAAAAAAAAAAAA,,ICD-10:M20.2,Acquired hallux rigidus (M20.2),Hallux rigidus (M20.2),Acquired hallux rigidus,Hallux rigidus,,,Diagnosis,N/A,,,,,
150126AAAAAAAAAAAAAAAAAAAAAAAAAAAAAA,,ICD-10:L70.0,Acne Vulgaris (L70.0),Acne vulgaire (L70.0),Acne Vulgaris,Acne vulgaire,,,Diagnosis,N/A,,,,,
150136AAAAAAAAAAAAAAAAAAAAAAAAAAAAAA,,ICD-10:L73.0,Acne Keloid (L73.0),Acne cheloidienne (L73.0),Acne Keloid,Acne cheloidienne,,,Diagnosis,N/A,,,,,
150142AAAAAAAAAAAAAAAAAAAAAAAAAAAAAA,,ICD-10:L70.1,Acne Conglobata (L70.1),Acne conglobata (L70.1),Acne Conglobata,Acne conglobata,,,Diagnosis,N/A,,,,,
150433AAAAAAAAAAAAAAAAAAAAAAAAAAAAAA,,ICD-10:X34,Accident caused by earthquake (X34),Accident de tremblement de terre (X34),Accident caused by earthquake,Accident de tremblement de terre,,,Diagnosis,N/A,,,,,
150737AAAAAAAAAAAAAAAAAAAAAAAAAAAAAA,,ICD-10:T14.0,Abrasion (T14.0),Abrasion (T14.0),Abrasion,Abrasion,,,Diagnosis,N/A,,,,,
150746AAAAAAAAAAAAAAAAAAAAAAAAAAAAAA,,ICD-10:O05.5,Abortion with sepsis (O05.5),Avortement septique (O05.5),Abortion with sepsis,Avortement septique,,,Diagnosis,N/A,,,,,
150802AAAAAAAAAAAAAAAAAAAAAAAAAAAAAA,,ICD-10:N93.9,Abnormal vaginal bleeding (N93.9),Saignements uterins anormaux (N93.9),Abnormal vaginal bleeding,Saignements uterins anormaux,,,Diagnosis,N/A,,,,,
151575AAAAAAAAAAAAAAAAAAAAAAAAAAAAAA,,ICD-10:Z30.9,Contraceptive Management (Z30.9),Prise en charge d'une contraception (Z30.9),Contraceptive Management,Prise en charge d'une contraception,,,Diagnosis,N/A,,,,,
151834AAAAAAAAAAAAAAAAAAAAAAAAAAAAAA,,ICD-10:C85.9,Non-Hodgkin's malignant lymphoma (C85.9),Lymphome non hodgkinien (C85.9),Non-Hodgkin's malignant lymphoma,Lymphome non hodgkinien,,,Diagnosis,N/A,,,,,
151907AAAAAAAAAAAAAAAAAAAAAAAAAAAAAA,,ICD-10:R52.9,Vague Bodily Discomfort (R52.9),Malaise corporel imprecis (R52.9),Vague Bodily Discomfort,Malaise corporel imprecis,,,Diagnosis,N/A,,,,,
151939AAAAAAAAAAAAAAAAAAAAAAAAAAAAAA,,ICD-10:L40.4,Guttate Psoriasis (L40.4),Psoriasis en goutte (L40.4),Guttate Psoriasis,Psoriasis en goutte,,,Diagnosis,N/A,,,,,
152039AAAAAAAAAAAAAAAAAAAAAAAAAAAAAA,,ICD-10:S08.0,Avulsion of Scalp (S08.0),Arrachement du cuir chevelu (S08.0),Avulsion of Scalp,Arrachement du cuir chevelu,,,Diagnosis,N/A,,,,,
152140AAAAAAAAAAAAAAAAAAAAAAAAAAAAAA,,ICD-10:S53.0,Dislocation of radial head (S53.0),Luxation de la tete radiale (S53.0),Dislocation of radial head,Luxation de la tete radiale,,,Diagnosis,N/A,,,,,
152202AAAAAAAAAAAAAAAAAAAAAAAAAAAAAA,,ICD-10:E42,Marasmic Kwashiorkor (E42),Kwashiorkor avec marasme (E42),Marasmic Kwashiorkor,Kwashiorkor avec marasme,,,Diagnosis,N/A,,,,,
152230AAAAAAAAAAAAAAAAAAAAAAAAAAAAAA,,ICD-10:M54.4,Lumbago with Sciatica (M54.4),Lombalgie avec sciatique (M54.4),Lumbago with Sciatica,Lombalgie avec sciatique,,,Diagnosis,N/A,,,,,
152265AAAAAAAAAAAAAAAAAAAAAAAAAAAAAA,,ICD-10:P24.3,Neonatal aspiration of milk and regurgitated food (P24.3),Aspiration de lait et d'aliments regurgites (P24.3),Neonatal aspiration of milk and regurgitated food,Aspiration de lait et d'aliments regurgites,,,Diagnosis,N/A,,,,,
152266AAAAAAAAAAAAAAAAAAAAAAAAAAAAAA,,ICD-10:P29.0,Neonatal cardiac failure (P29.0),"Insuffisance cardiaque, neonatale (P29.0)",Neonatal cardiac failure,"Insuffisance cardiaque, neonatale",,,Diagnosis,N/A,,,,,
152288AAAAAAAAAAAAAAAAAAAAAAAAAAAAAA,,ICD-10:R10.2,Pelvic and Perineal Pain (R10.2),Douleur pelvienne et perineale (uniquement pour sexe feminin) (R10.2),Pelvic and Perineal Pain,Douleur pelvienne et perineale (uniquement pour sexe feminin),,,Diagnosis,N/A,,,,,
152304AAAAAAAAAAAAAAAAAAAAAAAAAAAAAA,,ICD-10:K91.3,Postoperative Intestinal Obstruction (K91.3),Occlusion intestinale post-operatoire (K91.3),Postoperative Intestinal Obstruction,Occlusion intestinale post-operatoire,,,Diagnosis,N/A,,,,,
152339AAAAAAAAAAAAAAAAAAAAAAAAAAAAAA,,ICD-10:M06.0,Seronegative rheumatoid arthritis (M06.0),Arthrite rhumatoïde seronegative (M06.0),Seronegative rheumatoid arthritis,Arthrite rhumatoïde seronegative,,,Diagnosis,N/A,,,,,
152370AAAAAAAAAAAAAAAAAAAAAAAAAAAAAA,,ICD-10:T74.2,Sexual Abuse (T74.2),Abus sexuel (T74.2),Sexual Abuse,Abus sexuel,,,Diagnosis,N/A,,,,,
152404AAAAAAAAAAAAAAAAAAAAAAAAAAAAAA,,ICD-10:S13.0,Traumatic rupture of cervical intervertebral disc (S13.0),Rupture traumatique d'un disque intervertebral cervical (S13.0),Traumatic rupture of cervical intervertebral disc,Rupture traumatique d'un disque intervertebral cervical,,,Diagnosis,N/A,,,,,
152405AAAAAAAAAAAAAAAAAAAAAAAAAAAAAA,,ICD-10:S33.0,Traumatic rupture of lumbar intervertebral disc (S33.0),Rupture traumatique d'un disque intervertebral lombaire (S33.0),Traumatic rupture of lumbar intervertebral disc,Rupture traumatique d'un disque intervertebral lombaire,,,Diagnosis,N/A,,,,,
152406AAAAAAAAAAAAAAAAAAAAAAAAAAAAAA,,ICD-10:S33.4,Traumatic rupture of symphysis pubis (S33.4),Rupture traumatique de la symphyse pubienne (S33.4),Traumatic rupture of symphysis pubis,Rupture traumatique de la symphyse pubienne,,,Diagnosis,N/A,,,,,
152415AAAAAAAAAAAAAAAAAAAAAAAAAAAAAA,,ICD-10:S78.1,Traumatic Amputation at Level between Hip and Knee (S78.1),Amputation traumatique entre la hanche et le genou (S78.1),Traumatic Amputation at Level between Hip and Knee,Amputation traumatique entre la hanche et le genou,,,Diagnosis,N/A,,,,,
152421AAAAAAAAAAAAAAAAAAAAAAAAAAAAAA,,ICD-10:S08.1,Traumatic Amputation of Ear (S08.1),Amputation traumatique de l'oreille (S08.1),Traumatic Amputation of Ear,Amputation traumatique de l'oreille,,,Diagnosis,N/A,,,,,
152491AAAAAAAAAAAAAAAAAAAAAAAAAAAAAA,,ICD-10:D13.2,Benign Neoplasm of Duodenum (D13.2),Tumeur benigne du duodenum (D13.2),Benign Neoplasm of Duodenum,Tumeur benigne du duodenum,,,Diagnosis,N/A,,,,,
152595AAAAAAAAAAAAAAAAAAAAAAAAAAAAAA,,ICD-10:M33.9,Polymyositis-Dermatomyositis (M33.9),Dermatopolymyosite (M33.9),Polymyositis-Dermatomyositis,Dermatopolymyosite,,,Diagnosis,N/A,,,,,
153112AAAAAAAAAAAAAAAAAAAAAAAAAAAAAA,,ICD-10:R13,"Dysphagia, Oral Phase (R13)","Dysphagie, phase orale (R13)","Dysphagia, Oral Phase","Dysphagie, phase orale",,,Diagnosis,N/A,,,,,
153205AAAAAAAAAAAAAAAAAAAAAAAAAAAAAA,,ICD-10:D07.3,Carcinoma in Situ of Female Genital Organ (D07.3),Carcinome in situ d'organes genitaux de la femme (D07.3),Carcinoma in Situ of Female Genital Organ,Carcinome in situ d'organes genitaux de la femme,,,Diagnosis,N/A,,,,,
153551AAAAAAAAAAAAAAAAAAAAAAAAAAAAAA,,ICD-10:O26.8,Abdominal pain complicating pregnancy (O26.8),Douleurs abdominales compliquant la grossesse (O26.8),Abdominal pain complicating pregnancy,Douleurs abdominales compliquant la grossesse,,,Diagnosis,N/A,,,,,
153659AAAAAAAAAAAAAAAAAAAAAAAAAAAAAA,,ICD-10:Q21.2,Atrioventricular canal defect (Q21.2),Communication auriculo-ventriculaire (Q21.2),Atrioventricular canal defect,Communication auriculo-ventriculaire,,,Diagnosis,N/A,,,,,
154007AAAAAAAAAAAAAAAAAAAAAAAAAAAAAA,,ICD-10:I25.1,Coronary artery disease (I25.1),Maladie arterielle coronaire (I25.1),Coronary artery disease,Maladie arterielle coronaire,,,Diagnosis,N/A,,,,,
154226AAAAAAAAAAAAAAAAAAAAAAAAAAAAAA,,ICD-10:S83.5,Sprain of posterior cruciate ligament of knee (S83.5),Entorse des ligaments croises du genou (posterieur) (S83.5),Sprain of posterior cruciate ligament of knee,Entorse des ligaments croises du genou (posterieur),,,Diagnosis,N/A,,,,,
154355AAAAAAAAAAAAAAAAAAAAAAAAAAAAAA,,ICD-10:O14.1,HELLP (hemolytic anemia/elev liver enzymes/low platelets in pregnancy) (O14.1),HELLP syndrome (O14.1),HELLP (hemolytic anemia/elev liver enzymes/low platelets in pregnancy),HELLP syndrome,,,Diagnosis,N/A,,,,,
154937AAAAAAAAAAAAAAAAAAAAAAAAAAAAAA,,ICD-10:F23.9,Acute and transient psychotic disorder (F23.9),Trouble psychotique aigu et transitoire (F23.9),Acute and transient psychotic disorder,Trouble psychotique aigu et transitoire,,,Diagnosis,N/A,,,,,
155023AAAAAAAAAAAAAAAAAAAAAAAAAAAAAA,,ICD-10:L23.9,Allergic contact dermatitis (L23.9),Dermite allergique de contact (L23.9),Allergic contact dermatitis,Dermite allergique de contact,,,Diagnosis,N/A,,,,,
155177AAAAAAAAAAAAAAAAAAAAAAAAAAAAAA,,ICD-10:Y00,assault by blunt object (Y00),Agression par objet contondant (Y00),assault by blunt object,Agression par objet contondant,,,Diagnosis,N/A,,,,,
155259AAAAAAAAAAAAAAAAAAAAAAAAAAAAAA,,ICD-10:D17.9,Benign lipomatous neoplasm (D17.9),Tumeur lipomateuse benigne (D17.9),Benign lipomatous neoplasm,Tumeur lipomateuse benigne,,,Diagnosis,N/A,,,,,
155269AAAAAAAAAAAAAAAAAAAAAAAAAAAAAA,,ICD-10:D13.3,benign neoplasm of other and unspecified parts of small intestine (D13.3),Tumeur benigne de l'intestin grele (D13.3),benign neoplasm of other and unspecified parts of small intestine,Tumeur benigne de l'intestin grele,,,Diagnosis,N/A,,,,,
155273AAAAAAAAAAAAAAAAAAAAAAAAAAAAAA,,ICD-10:D12.8,Benign neoplasm of rectum (D12.8),Tumeur benigne du rectum (D12.8),Benign neoplasm of rectum,Tumeur benigne du rectum,,,Diagnosis,N/A,,,,,
155318AAAAAAAAAAAAAAAAAAAAAAAAAAAAAA,,ICD-10:A30.4,Borderline lepromatous leprosy (A30.4),Lepre borderline lepromateuse (A30.4),Borderline lepromatous leprosy,Lepre borderline lepromateuse,,,Diagnosis,N/A,,,,,
155319AAAAAAAAAAAAAAAAAAAAAAAAAAAAAA,,ICD-10:A30.2,Borderline tuberculoid leprosy (A30.2),Lepre borderline tuberculoide (A30.2),Borderline tuberculoid leprosy,Lepre borderline tuberculoide,,,Diagnosis,N/A,,,,,
155351AAAAAAAAAAAAAAAAAAAAAAAAAAAAAA,,ICD-10:T25.0,burn of unspecified degree of ankle and foot (T25.0),Brulure et corrosion de la cheville et du pied (T25.0),burn of unspecified degree of ankle and foot,Brulure et corrosion de la cheville et du pied,,,Diagnosis,N/A,,,,,
155436AAAAAAAAAAAAAAAAAAAAAAAAAAAAAA,,ICD-10:K02.1,Caries of dentine (K02.1),Carie de la dentine (K02.1),Caries of dentine,Carie de la dentine,,,Diagnosis,N/A,,,,,
155479AAAAAAAAAAAAAAAAAAAAAAAAAAAAAA,,ICD-10:I63.9,Cerebral infarction (I63.9),Infarctus cerebral (I63.9),Cerebral infarction,Infarctus cerebral,,,Diagnosis,N/A,,,,,
155579AAAAAAAAAAAAAAAAAAAAAAAAAAAAAA,,ICD-10:N94.9,Chronic pelvic pain in female (N94.9),Douleur pelvienne chronique (N94.9),Chronic pelvic pain in female,Douleur pelvienne chronique,,,Diagnosis,N/A,,,,,
155679AAAAAAAAAAAAAAAAAAAAAAAAAAAAAA,,ICD-10:P61.3,Congenital anemia from fetal blood loss (P61.3),"Anemie, congenitale, par perte de sang foetal (P61.3)",Congenital anemia from fetal blood loss,"Anemie, congenitale, par perte de sang foetal",,,Diagnosis,N/A,,,,,
155701AAAAAAAAAAAAAAAAAAAAAAAAAAAAAA,,ICD-10:Q51.9,Congenital malformation of uterus and cervix (Q51.9),Malformations congenitales de l'uterus et du col de l'uterus (Q51.9),Congenital malformation of uterus and cervix,Malformations congenitales de l'uterus et du col de l'uterus,,,Diagnosis,N/A,,,,,
155720AAAAAAAAAAAAAAAAAAAAAAAAAAAAAA,,ICD-10:Q76.3,Congenital scoliosis due to congenital bony malformation (Q76.3),Scoliose congenitale due a une malformation osseuse congenitale (Q76.3),Congenital scoliosis due to congenital bony malformation,Scoliose congenitale due a une malformation osseuse congenitale,,,Diagnosis,N/A,,,,,
155753AAAAAAAAAAAAAAAAAAAAAAAAAAAAAA,,ICD-10:T14.0,Contusion of soft tissue (T14.0),Contusion des parties molles (T14.0),Contusion of soft tissue,Contusion des parties molles,,,Diagnosis,N/A,,,,,
155804AAAAAAAAAAAAAAAAAAAAAAAAAAAAAA,,ICD-10:S07.9,"crushing injury of head, part unspecified (S07.9)",Ecrasement de la tete (S07.9),"crushing injury of head, part unspecified",Ecrasement de la tete,,,Diagnosis,N/A,,,,,
155838AAAAAAAAAAAAAAAAAAAAAAAAAAAAAA,,ICD-10:B69.0,Cysticercosis of central nervous system (B69.0),Cysticercose du systeme nerveux central (B69.0),Cysticercosis of central nervous system,Cysticercose du systeme nerveux central,,,Diagnosis,N/A,,,,,
155884AAAAAAAAAAAAAAAAAAAAAAAAAAAAAA,,ICD-10:O82.9,Delivery by cesarean section (O82.9),Accouchement par cesarienne (O82.9),Delivery by cesarean section,Accouchement par cesarienne,,,Diagnosis,N/A,,,,,
155977AAAAAAAAAAAAAAAAAAAAAAAAAAAAAA,,ICD-10:N75.9,Disease of bartholin's gland (N75.9),Affection de la glande de Bartholin (N75.9),Disease of bartholin's gland,Affection de la glande de Bartholin,,,Diagnosis,N/A,,,,,
155988AAAAAAAAAAAAAAAAAAAAAAAAAAAAAA,,ICD-10:S93.1,dislocation of phalanx of foot (S93.1),Luxation d'un (des) orteil(s) (S93.1),dislocation of phalanx of foot,Luxation d'un (des) orteil(s),,,Diagnosis,N/A,,,,,
156027AAAAAAAAAAAAAAAAAAAAAAAAAAAAAA,,ICD-10:F44.5,Dissociative convulsions (F44.5),Convulsions dissociatives ou crises de conversion (F44.5),Dissociative convulsions,Convulsions dissociatives ou crises de conversion,,,Diagnosis,N/A,,,,,
156199AAAAAAAAAAAAAAAAAAAAAAAAAAAAAA,,ICD-10:W87,Exposure to electric current (W87),Choc electrique (W87),Exposure to electric current,Choc electrique,,,Diagnosis,N/A,,,,,
156206AAAAAAAAAAAAAAAAAAAAAAAAAAAAAA,,ICD-10:P07.0,Extremely low birth weight infant (P07.0),Poids extremement faible a la naissance <1000g (P07.0),Extremely low birth weight infant,Poids extremement faible a la naissance <1000g,,,Diagnosis,N/A,,,,,
156218AAAAAAAAAAAAAAAAAAAAAAAAAAAAAA,,ICD-10:O07.1,Incomplete provoked abortion with hemorrhage (O07.1),"Avortement provoque incomplet, avec hemorragie (O07.1)",Incomplete provoked abortion with hemorrhage,"Avortement provoque incomplet, avec hemorragie",,,Diagnosis,N/A,,,,,
156343AAAAAAAAAAAAAAAAAAAAAAAAAAAAAA,,ICD-10:L72.9,Follicular cyst of skin and subcutaneous tissue (L72.9),Kyste folliculaires de la peau et du tissu cellulaire sous-cutane (L72.9),Follicular cyst of skin and subcutaneous tissue,Kyste folliculaires de la peau et du tissu cellulaire sous-cutane,,,Diagnosis,N/A,,,,,
156355AAAAAAAAAAAAAAAAAAAAAAAAAAAAAA,,ICD-10:T17.9,foreign body in respiratory tract (T17.9),Corps etranger dans les voies respiratoires (T17.9),foreign body in respiratory tract,Corps etranger dans les voies respiratoires,,,Diagnosis,N/A,,,,,
156366AAAAAAAAAAAAAAAAAAAAAAAAAAAAAA,,ICD-10:S32.2,Fracture of coccyx (S32.2),Fracture du coccyx (S32.2),Fracture of coccyx,Fracture du coccyx,,,Diagnosis,N/A,,,,,
156369AAAAAAAAAAAAAAAAAAAAAAAAAAAAAA,,ICD-10:S52.5,Fracture of distal end of radius (S52.5),Fracture de l'extremite inferieure du radius (S52.5),Fracture of distal end of radius,Fracture de l'extremite inferieure du radius,,,Diagnosis,N/A,,,,,
156370AAAAAAAAAAAAAAAAAAAAAAAAAAAAAA,,ICD-10:S82.3,Fracture of distal end of tibia (S82.3),Fracture de l'extremite inferieure du tibia (S82.3),Fracture of distal end of tibia,Fracture de l'extremite inferieure du tibia,,,Diagnosis,N/A,,,,,
156386AAAAAAAAAAAAAAAAAAAAAAAAAAAAAA,,ICD-10:S32.0,Fracture of lumbar vertebra (S32.0),Fracture d'une vertebre lombaire (S32.0),Fracture of lumbar vertebra,Fracture d'une vertebre lombaire,,,Diagnosis,N/A,,,,,
156397AAAAAAAAAAAAAAAAAAAAAAAAAAAAAA,,ICD-10:S62.8,fracture of other and unspecified parts of wrist and hand (S62.8),Fracture au niveau du poignet et de la main (S62.8),fracture of other and unspecified parts of wrist and hand,Fracture au niveau du poignet et de la main,,,Diagnosis,N/A,,,,,
156399AAAAAAAAAAAAAAAAAAAAAAAAAAAAAA,,ICD-10:S32.1,Fracture of sacrum (S32.1),Fracture du sacrum (S32.1),Fracture of sacrum,Fracture du sacrum,,,Diagnosis,N/A,,,,,
156402AAAAAAAAAAAAAAAAAAAAAAAAAAAAAA,,ICD-10:S12.1,Fracture of second cervical vertebra (S12.1),Fracture de la deuxieme vertebre cervicale (S12.1),Fracture of second cervical vertebra,Fracture de la deuxieme vertebre cervicale,,,Diagnosis,N/A,,,,,
